{
  "pipeline": "baseline",
  "benchmark_name": "DICOM Privacy Auditor Synthetic Benchmark",
  "summary": {
    "cases": 60,
    "injections": 50,
    "removed_injections": 50,
    "residual_injections": 0,
    "removal_rate": 1.0,
    "removal_rate_ci95": [
      0.9286524008666414,
      1.0
    ],
    "auditor_detected_residuals": 0,
    "auditor_residual_sensitivity": null,
    "auditor_residual_sensitivity_ci95": null,
    "clean_controls": 10,
    "false_positive_controls": 0,
    "false_positive_control_rate": 0.0,
    "false_positive_control_rate_ci95": [
      0.0,
      0.2775327998628892
    ],
    "readable_outputs": 60,
    "basic_valid_outputs": 60,
    "total_runtime_seconds": 0.13196049099985885,
    "mean_runtime_seconds": 0.0021993415166643143
  },
  "by_stratum": [
    {
      "stratum": "file_meta",
      "injections": 5,
      "removed": 5,
      "residual": 0,
      "removal_rate": 1.0,
      "removal_rate_ci95_low": 0.5655175352168251,
      "removal_rate_ci95_high": 1.0,
      "auditor_detected_residuals": 0,
      "auditor_residual_sensitivity": null
    },
    {
      "stratum": "filename",
      "injections": 5,
      "removed": 5,
      "residual": 0,
      "removal_rate": 1.0,
      "removal_rate_ci95_low": 0.5655175352168251,
      "removal_rate_ci95_high": 1.0,
      "auditor_detected_residuals": 0,
      "auditor_residual_sensitivity": null
    },
    {
      "stratum": "free_text",
      "injections": 5,
      "removed": 5,
      "residual": 0,
      "removal_rate": 1.0,
      "removal_rate_ci95_low": 0.5655175352168251,
      "removal_rate_ci95_high": 1.0,
      "auditor_detected_residuals": 0,
      "auditor_residual_sensitivity": null
    },
    {
      "stratum": "nested_sequence",
      "injections": 5,
      "removed": 5,
      "residual": 0,
      "removal_rate": 1.0,
      "removal_rate_ci95_low": 0.5655175352168251,
      "removal_rate_ci95_high": 1.0,
      "auditor_detected_residuals": 0,
      "auditor_residual_sensitivity": null
    },
    {
      "stratum": "pixel_annotation",
      "injections": 5,
      "removed": 5,
      "residual": 0,
      "removal_rate": 1.0,
      "removal_rate_ci95_low": 0.5655175352168251,
      "removal_rate_ci95_high": 1.0,
      "auditor_detected_residuals": 0,
      "auditor_residual_sensitivity": null
    },
    {
      "stratum": "preamble",
      "injections": 5,
      "removed": 5,
      "residual": 0,
      "removal_rate": 1.0,
      "removal_rate_ci95_low": 0.5655175352168251,
      "removal_rate_ci95_high": 1.0,
      "auditor_detected_residuals": 0,
      "auditor_residual_sensitivity": null
    },
    {
      "stratum": "private_attribute",
      "injections": 5,
      "removed": 5,
      "residual": 0,
      "removal_rate": 1.0,
      "removal_rate_ci95_low": 0.5655175352168251,
      "removal_rate_ci95_high": 1.0,
      "auditor_detected_residuals": 0,
      "auditor_residual_sensitivity": null
    },
    {
      "stratum": "standard_metadata",
      "injections": 5,
      "removed": 5,
      "residual": 0,
      "removal_rate": 1.0,
      "removal_rate_ci95_low": 0.5655175352168251,
      "removal_rate_ci95_high": 1.0,
      "auditor_detected_residuals": 0,
      "auditor_residual_sensitivity": null
    },
    {
      "stratum": "temporal",
      "injections": 5,
      "removed": 5,
      "residual": 0,
      "removal_rate": 1.0,
      "removal_rate_ci95_low": 0.5655175352168251,
      "removal_rate_ci95_high": 1.0,
      "auditor_detected_residuals": 0,
      "auditor_residual_sensitivity": null
    },
    {
      "stratum": "uid",
      "injections": 5,
      "removed": 5,
      "residual": 0,
      "removal_rate": 1.0,
      "removal_rate_ci95_low": 0.5655175352168251,
      "removal_rate_ci95_high": 1.0,
      "auditor_detected_residuals": 0,
      "auditor_residual_sensitivity": null
    }
  ],
  "cases": [
    {
      "pipeline": "baseline",
      "case_id": "case-00001",
      "clean_control": false,
      "output_present": true,
      "readable": true,
      "valid_basic": true,
      "runtime_seconds": 0.002657305999946402,
      "high_or_critical_findings": 0,
      "error": null,
      "injections": [
        {
          "pipeline": "baseline",
          "case_id": "case-00001",
          "injection_id": "case-00001:temporal:001",
          "stratum": "temporal",
          "output_present": true,
          "residual": false,
          "removed": true,
          "auditor_detected": false,
          "finding_codes": [],
          "similarity": null,
          "error": null
        }
      ]
    },
    {
      "pipeline": "baseline",
      "case_id": "case-00002",
      "clean_control": false,
      "output_present": true,
      "readable": true,
      "valid_basic": true,
      "runtime_seconds": 0.0021065290000024106,
      "high_or_critical_findings": 0,
      "error": null,
      "injections": [
        {
          "pipeline": "baseline",
          "case_id": "case-00002",
          "injection_id": "case-00002:uid:001",
          "stratum": "uid",
          "output_present": true,
          "residual": false,
          "removed": true,
          "auditor_detected": false,
          "finding_codes": [],
          "similarity": null,
          "error": null
        }
      ]
    },
    {
      "pipeline": "baseline",
      "case_id": "case-00003",
      "clean_control": false,
      "output_present": true,
      "readable": true,
      "valid_basic": true,
      "runtime_seconds": 0.0025835099999085287,
      "high_or_critical_findings": 0,
      "error": null,
      "injections": [
        {
          "pipeline": "baseline",
          "case_id": "case-00003",
          "injection_id": "case-00003:standard_metadata:001",
          "stratum": "standard_metadata",
          "output_present": true,
          "residual": false,
          "removed": true,
          "auditor_detected": false,
          "finding_codes": [],
          "similarity": null,
          "error": null
        }
      ]
    },
    {
      "pipeline": "baseline",
      "case_id": "case-00004",
      "clean_control": false,
      "output_present": true,
      "readable": true,
      "valid_basic": true,
      "runtime_seconds": 0.002794870999991872,
      "high_or_critical_findings": 1,
      "error": null,
      "injections": [
        {
          "pipeline": "baseline",
          "case_id": "case-00004",
          "injection_id": "case-00004:pixel_annotation:001",
          "stratum": "pixel_annotation",
          "output_present": true,
          "residual": false,
          "removed": true,
          "auditor_detected": false,
          "finding_codes": [
            "PIXEL_TEXT_LIKE_REGION"
          ],
          "similarity": 0.0,
          "error": null
        }
      ]
    },
    {
      "pipeline": "baseline",
      "case_id": "case-00005",
      "clean_control": false,
      "output_present": true,
      "readable": true,
      "valid_basic": true,
      "runtime_seconds": 0.001958585000011226,
      "high_or_critical_findings": 0,
      "error": null,
      "injections": [
        {
          "pipeline": "baseline",
          "case_id": "case-00005",
          "injection_id": "case-00005:uid:001",
          "stratum": "uid",
          "output_present": true,
          "residual": false,
          "removed": true,
          "auditor_detected": false,
          "finding_codes": [],
          "similarity": null,
          "error": null
        }
      ]
    },
    {
      "pipeline": "baseline",
      "case_id": "case-00006",
      "clean_control": false,
      "output_present": true,
      "readable": true,
      "valid_basic": true,
      "runtime_seconds": 0.0018908670000428174,
      "high_or_critical_findings": 0,
      "error": null,
      "injections": [
        {
          "pipeline": "baseline",
          "case_id": "case-00006",
          "injection_id": "case-00006:standard_metadata:001",
          "stratum": "standard_metadata",
          "output_present": true,
          "residual": false,
          "removed": true,
          "auditor_detected": false,
          "finding_codes": [],
          "similarity": null,
          "error": null
        }
      ]
    },
    {
      "pipeline": "baseline",
      "case_id": "case-00007",
      "clean_control": false,
      "output_present": true,
      "readable": true,
      "valid_basic": true,
      "runtime_seconds": 0.0024564400000599562,
      "high_or_critical_findings": 0,
      "error": null,
      "injections": [
        {
          "pipeline": "baseline",
          "case_id": "case-00007",
          "injection_id": "case-00007:free_text:001",
          "stratum": "free_text",
          "output_present": true,
          "residual": false,
          "removed": true,
          "auditor_detected": false,
          "finding_codes": [
            "FREE_TEXT_REVIEW"
          ],
          "similarity": null,
          "error": null
        }
      ]
    },
    {
      "pipeline": "baseline",
      "case_id": "case-00008",
      "clean_control": false,
      "output_present": true,
      "readable": true,
      "valid_basic": true,
      "runtime_seconds": 0.002678984999988643,
      "high_or_critical_findings": 0,
      "error": null,
      "injections": [
        {
          "pipeline": "baseline",
          "case_id": "case-00008",
          "injection_id": "case-00008:free_text:001",
          "stratum": "free_text",
          "output_present": true,
          "residual": false,
          "removed": true,
          "auditor_detected": false,
          "finding_codes": [
            "FREE_TEXT_REVIEW"
          ],
          "similarity": null,
          "error": null
        }
      ]
    },
    {
      "pipeline": "baseline",
      "case_id": "case-00009",
      "clean_control": false,
      "output_present": true,
      "readable": true,
      "valid_basic": true,
      "runtime_seconds": 0.0024254360000668385,
      "high_or_critical_findings": 0,
      "error": null,